text,metadata,level
"Văn bản nêu rõ cơ sở pháp lý cho các quy định, hướng dẫn dành cho sinh viên Đại học Bách khoa Hà Nội, dựa trên Luật Giáo dục đại học (2012 và sửa đổi 2018) và các Nghị định số 99/2019/NĐ-CP (có vẻ như có lỗi đánh máy, cần kiểm tra lại ngày ban hành chính xác) của Chính phủ về việc hướng dẫn thi hành Luật Giáo dục đại học.  Ngoài ra, văn bản còn đề cập đến Quy chế Tổ chức và hoạt động của Đại học Bách khoa Hà Nội.  Tóm lại, đây là văn bản có tính chất pháp lý, làm cơ sở cho các quy định cụ thể dành cho sinh viên trường.","{""id"": [""3"", ""4"", ""5""], ""source"": [""20230710 2. QĐ Học bổng Trần Đại Nghĩa 2023.txt""]}",1
"Tổ chức và hoạt động của Đại học Bách khoa Hà Nội được quy định bởi Nghị quyết số 17/NQ-ĐHBK ngày 16/3/2023.  Việc quản lý tài chính của trường dựa trên Nghị quyết số 20/NQ-ĐHBK ngày 16/3/2023,  và quy chế chi tiêu nội bộ được ban hành bởi Quyết định số 1736/QĐ-ĐHBK ngày 16/3/2023.  Tóm lại, các văn bản này thiết lập khuôn khổ pháp lý cho hoạt động và quản lý tài chính của Đại học Bách khoa Hà Nội, dựa trên đề nghị của Trưởng phòng Công tác sinh viên.","{""id"": [""6"", ""7"", ""8"", ""9""], ""source"": [""20230710 2. QĐ Học bổng Trần Đại Nghĩa 2023.txt""]}",1
"Quyết định ban hành Quy định quản lý và xét, cấp học bổng Trần Đại Nghĩa cho sinh viên Đại học Bách khoa Hà Nội.  Quy định này thành lập Hội đồng xét cấp học bổng do Phó Giám đốc phụ trách công tác sinh viên làm chủ tịch.  Hội đồng có trách nhiệm xét cấp học bổng, đề xuất sửa đổi bổ sung quy định.  Các đơn vị liên quan có trách nhiệm quảng bá và thu hút tài trợ.  Quy định có hiệu lực kể từ ngày ký.  Vi phạm quy định sẽ bị xử lý kỷ luật, đóng góp tích cực sẽ được khen thưởng.  Vướng mắc trong quá trình thực hiện cần báo cáo Giám đốc thông qua Phòng Công tác sinh viên để đề xuất sửa đổi, bổ sung.","{""id"": [""10"", ""11"", ""28"", ""29"", ""31"", ""32""], ""source"": [""20230710 2. QĐ Học bổng Trần Đại Nghĩa 2023.txt""]}",1
"Học bổng Trần Đại Nghĩa của Đại học Bách khoa Hà Nội nhằm hỗ trợ sinh viên có hoàn cảnh khó khăn, có thành tích học tập tốt và những sinh viên gặp khó khăn đột xuất.  Đối tượng áp dụng là sinh viên chính quy năm nhất hoặc các năm học tiếp theo.  Sinh viên năm nhất được xét học bổng nếu đạt thành tích cao trong Olympic quốc tế, kỳ thi học sinh giỏi quốc gia hoặc điểm thi đại học cao. Sinh viên các năm học tiếp theo phải có điểm trung bình tích lũy (CPA) ≥ 2.0, điểm rèn luyện ≥ 65, hoàn thành đủ tín chỉ và có hoàn cảnh khó khăn (hộ nghèo, cận nghèo, hoặc gặp tai nạn, bệnh hiểm nghèo, thiên tai...).  Những trường hợp đặc biệt khác sẽ do Giám đốc Đại học quyết định.","{""id"": [""13"", ""16"", ""17"", ""18""], ""source"": [""20230710 2. QĐ Học bổng Trần Đại Nghĩa 2023.txt""]}",1
"Quy định về Học bổng Trần Đại Nghĩa tại ĐHBK Hà Nội dành cho sinh viên chính quy. Nguồn học bổng đến từ nhiều nguồn: kinh phí ĐHBK Hà Nội, đóng góp của cán bộ, viên chức, sinh viên, cựu sinh viên và nhà hảo tâm.  Việc cấp học bổng tự nguyện, công khai, minh bạch, tuân thủ quy định pháp luật.  Phòng Công tác sinh viên là đơn vị chủ trì tiếp nhận, thẩm định hồ sơ; Phòng Đào tạo cung cấp kết quả học tập; Phòng Tài chính - Kế toán quản lý kinh phí và công khai thông tin; Phòng Truyền thông quảng bá học bổng.  Hội đồng xét học bổng gồm đại diện các phòng ban liên quan và các tổ chức sinh viên.  Những cá nhân, tổ chức đóng góp nhiều sẽ được khen thưởng.","{""id"": [""14"", ""15"", ""25"", ""26"", ""27"", ""30""], ""source"": [""20230710 2. QĐ Học bổng Trần Đại Nghĩa 2023.txt""]}",1
"Quy định Học bổng Trần Đại Nghĩa tại Đại học Bách Khoa Hà Nội có hai mức: 5.000.000 đồng và 10.000.000 đồng, dành cho hai nhóm đối tượng khác nhau (được quy định tại Điều 5, khoản 1,2 và 3,4).  Sinh viên nhóm 1 (khoản 1, 2 Điều 5) đăng ký trực tuyến, kèm theo đơn đăng ký (có xác nhận địa phương), giấy tờ chứng minh hoàn cảnh khó khăn (giấy chứng nhận hộ nghèo/cận nghèo...), bản sao chứng thực thẻ căn cước/CMND, giấy xác nhận thông tin cư trú. Sinh viên nhóm 2 (khoản 3, 4 Điều 5) cần nộp văn bản đề nghị hỗ trợ từ các cơ quan, tổ chức và hồ sơ chứng minh rủi ro đột xuất. Phòng/Ban Công tác sinh viên là đơn vị tiếp nhận và thẩm định hồ sơ.  Hồ sơ đăng ký cần có thông tin cá nhân sinh viên, thông tin gia đình (bố mẹ, anh chị em) và mô tả tóm tắt hoàn cảnh khó khăn của gia đình.","{""id"": [""22"", ""23"", ""24"", ""34"", ""35"", ""36""], ""source"": [""20230710 2. QĐ Học bổng Trần Đại Nghĩa 2023.txt""]}",1
"Đại học Bách khoa Hà Nội ban hành quy định về học bổng Trần Đại Nghĩa dựa trên Luật Giáo dục đại học,  quy chế của trường và các nghị định của Chính phủ. Học bổng hỗ trợ sinh viên khó khăn về kinh tế, học tập hoặc gặp khó khăn đột xuất.  Có hai loại học bổng:  loại 1 (50% hoặc 100% học phí) dành cho sinh viên khó khăn về kinh tế, học tập; loại 2 (5.000.000đ hoặc 10.000.000đ) dành cho các trường hợp khác (tai nạn, thiên tai...).  Sinh viên không đăng ký học tập, đang bị kỷ luật, đã nhận học bổng khác (trừ học bổng khóa học), hoặc được miễn giảm học phí theo chính sách nhà nước sẽ không được xét.  Hội đồng xét học bổng do Phó Giám đốc phụ trách công tác sinh viên làm chủ tịch.  Hồ sơ đăng ký bao gồm thông tin cá nhân, gia đình và giấy tờ chứng minh hoàn cảnh.  Việc cấp học bổng công khai, minh bạch, dựa trên nhiều nguồn kinh phí.  Các phòng ban liên quan (Công tác sinh viên, Đào tạo, Tài chính - Kế toán, Truyền thông) có trách nhiệm cụ thể trong quá trình xét duyệt và quản lý học bổng.  Việc vi phạm quy định sẽ bị xử lý kỷ luật, đóng góp tích cực sẽ được khen thưởng.  Cơ sở pháp lý chính là Luật Giáo dục đại học (2012 và sửa đổi 2018), Nghị định số 99/2019/NĐ-CP (cần kiểm tra lại ngày ban hành) và các nghị quyết, quyết định nội bộ của trường (số 17, 20, 1736/QĐ-ĐHBK ngày 16/3/2023).","{""id"": [""0"", ""1"", ""12"", ""33"", ""2"", ""19"", ""20"", ""21"", ""3"", ""4"", ""5"", ""6"", ""7"", ""8"", ""9"", ""10"", ""11"", ""28"", ""29"", ""31"", ""32"", ""13"", ""16"", ""17"", ""18"", ""14"", ""15"", ""25"", ""26"", ""27"", ""30"", ""22"", ""23"", ""24"", ""34"", ""35"", ""36""], ""source"": [""20230710 2. QĐ Học bổng Trần Đại Nghĩa 2023.txt""]}",2
